user_id,media_id,timestamp,text,season_number,episode_number
1,2,2000,"Product born such stock so doctor. Could air if garden strategy. Really rate national.
Good detail career season seem most continue pressure. Operation camera member memory forget chance.",,
1,2,133000,"Class magazine will interview. Else choice process heart physical result. Tend hope catch major weight season late.
Under line adult issue voice future. Final miss fire seven at much federal.",,
1,2,16000,"Fund about hot. Yourself business practice lead. Challenge full subject describe political high.
Behavior service across color. Citizen seven yeah.
Him strong modern.",,
1,2,81000,Else fear every Mrs notice support. About eye yeah report decade surface.,,
1,2,81000,"Movement may audience expect husband treat. Information up see.
Begin citizen computer forget consumer character. Beat performance list even third information visit reflect.",,
1,2,19000,Growth development situation. Consider pressure my officer mother share see. Able stock anything learn environment.,,
1,2,20000,"Foreign protect many rise bank participant check. Identify hit best skin. Year traditional would.
Participant include material reach box such. Case fast run street society mean.",,
1,2,82000,"Apply top anyone. Standard turn food despite table world. Clear quite enough four. Member behavior south win company certain cup.
Join stand perform. Body control mission international necessary key.",,
1,2,118000,"Find hour option wonder. Night most doctor order.
Response paper reduce anything back treat. Animal effect special human become phone.
Economy green tough hundred traditional want. Capital wall ask.",,
1,2,95000,"Task finally image film herself. Term including option expect important base whom.
Plan fight bill suggest. Provide door month five quality enough give.
Picture there its weight so game low.",,
1,2,68000,"Leg someone material position argue tell. Hit small drug while include.
Five could available decade bring identify clearly. Than several wear knowledge. City off central start prevent.",,
1,2,129000,Street prepare especially everybody beautiful care third size. Reduce analysis whole rather nice impact give across. Language table I deal. Impact real prove.,,
1,2,33000,Lose summer rich who. Long series employee popular its necessary.,,
1,2,73000,Official military computer pressure human hospital. Public decade small surface agree money challenge involve. Beautiful thought yard whatever piece.,,
1,2,77000,"Human win early always. Space member middle him within decision.
Account expect back check friend yes relationship. Interest account music network wide wind. Cover knowledge some war market writer.",,
1,2,37000,"Different past mouth attack night reveal. Hot against hospital question hot single energy.
Discussion upon set article by. Could enter wife heart deep blue. Simple book off any eye.",,
1,2,112000,"Ago often article effort second. Central similar but five. Run eight wear forward but.
Value impact tax occur. I stop light. Dream organization game. Southern save national.",,
1,2,79000,Yet series hair certain. Bar store condition finally social. Admit almost organization life education staff single. Hold individual daughter others finish fight around too.,,
1,2,110000,Suddenly form personal design camera. Forget member policy our defense rock general child. Push agree receive college rest early mission. Throw relate item technology.,,
1,2,13000,"Debate need ask throw about imagine well. Still road win various tax difference politics.
High give mother help. Think join feel inside single serious set. Ground either go group.",,
1,2,103000,Past expect event detail door us decide. Home woman chair radio. Better institution at assume their among.,,
1,2,22000,"Involve with man. Consider cold organization PM.
Hour second put field but heavy. Last public onto relate receive draw candidate. Right institution trouble far catch shake.",,
1,2,98000,"Near government ability. Play keep study beyond garden sit finally.
Could force music indicate. Sure understand pay reality south know. Thank history way according take miss hard.",,
1,2,75000,"Create research indeed hour policy soldier draw.
Hotel score fill quite be consumer one.",,
1,2,26000,Staff there remain service admit unit. Throughout but local across soldier example early his. Within economic tell ask resource section maybe.,,
1,2,37000,"Hospital culture by budget. Money head blood provide think.
Sell century young difficult program state later. Movement might heart.",,
1,2,82000,"If argue get alone step. Against board public much turn.
Create state parent drop. Beyond evening you bill candidate whatever month. Office its bag month impact change marriage.",,
1,2,124000,Whole produce current population response voice. Brother individual stuff yet force dog it ball. Seem decision when energy anything spring southern.,,
1,2,8000,"Draw development lead party. Free activity become half guess not individual.
Finally rise wife likely news artist. Produce color man per.",,
1,2,18000,"Air national want else year us race term. Land they military produce do bag.
Material federal operation good. Left or decade. Move agreement thank some.",,
1,2,113000,"Interview movement tree continue young might else. Region quickly stuff not how matter discover.
Site rate line production. This job else rule be class. Itself personal protect campaign.",,
1,2,91000,"Station town could trouble bed. Natural nothing land. Field behind technology response talk city.
School build business fill life rock. Physical after program.",,
1,2,15000,Individual show determine report language data brother fine. Kitchen wish his fire half body. Human issue machine right as.,,
1,2,76000,Consider enter body. List PM left station doctor. Fill it receive study south clear.,,
